notebooks/day1_lab_outputs/detection_predictions.json

[
  {
    "sample_id": "traffic",
    "coco_image_id": 210273,
    "image_width": 640,
    "image_height": 428,
    "task": "object_detection",
    "taxonomy_name": "COCO-80",
    "model_file": "yolo11n.pt",
    "model_sha256": "0ebbc80d4a7680d14987a577cd21342b65ecfd94632bd9a8da63ae6417644ee1",
    "ultralytics_version": "8.4.145",
    "score_threshold": 0.6,
    "class_id": 5,
    "class_name": "bus",
    "score": 0.912558,
    "coordinate_unit": "pixel",
    "bbox_format": "xyxy",
    "bbox_xyxy": [
      93.17,
      187.95,
      223.01,
      320.91
    ],
    "bbox_width": 129.84,
    "bbox_height": 132.96
  },
  {
    "sample_id": "traffic",
    "coco_image_id": 210273,
    "image_width": 640,
    "image_height": 428,
    "task": "object_detection",
    "taxonomy_name": "COCO-80",
    "model_file": "yolo11n.pt",
    "model_sha256": "0ebbc80d4a7680d14987a577cd21342b65ecfd94632bd9a8da63ae6417644ee1",
    "ultralytics_version": "8.4.145",
    "score_threshold": 0.6,
    "class_id": 2,
    "class_name": "car",
    "score": 0.863074,
    "coordinate_unit": "pixel",
    "bbox_format": "xyxy",
    "bbox_xyxy": [
      419.05,
      264.24,
      497.95,
      339.85
    ],
    "bbox_width": 78.9,
    "bbox_height": 75.61
  },
  {
    "sample_id": "traffic",
    "coco_image_id": 210273,
    "image_width": 640,
    "image_height": 428,
    "task": "object_detection",
    "taxonomy_name": "COCO-80",
    "model_file": "yolo11n.pt",
    "model_sha256": "0ebbc80d4a7680d14987a577cd21342b65ecfd94632bd9a8da63ae6417644ee1",
    "ultralytics_version": "8.4.145",
    "score_threshold": 0.6,
    "class_id": 5,
    "class_name": "bus",
    "score": 0.847436,
    "coordinate_unit": "pixel",
    "bbox_format": "xyxy",
    "bbox_xyxy": [
      225.61,
      132.68,
      296.09,
      220.45
    ],
    "bbox_width": 70.48,
    "bbox_height": 87.76
  },
  {
    "sample_id": "traffic",
    "coco_image_id": 210273,
    "image_width": 640,
    "image_height": 428,
    "task": "object_detection",
    "taxonomy_name": "COCO-80",
    "model_file": "yolo11n.pt",
    "model_sha256": "0ebbc80d4a7680d14987a577cd21342b65ecfd94632bd9a8da63ae6417644ee1",
    "ultralytics_version": "8.4.145",
    "score_threshold": 0.6,
    "class_id": 2,
    "class_name": "car",
    "score": 0.846923,
    "coordinate_unit": "pixel",
    "bbox_format": "xyxy",
    "bbox_xyxy": [
      179.98,
      298.91,
      254.05,
      367.51
    ],
    "bbox_width": 74.07,
    "bbox_height": 68.6
  },
  {
    "sample_id": "traffic",
    "coco_image_id": 210273,
    "image_width": 640,
    "image_height": 428,
    "task": "object_detection",
    "taxonomy_name": "COCO-80",
    "model_file": "yolo11n.pt",
    "model_sha256": "0ebbc80d4a7680d14987a577cd21342b65ecfd94632bd9a8da63ae6417644ee1",
    "ultralytics_version": "8.4.145",
    "score_threshold": 0.6,
    "class_id": 2,
    "class_name": "car",
    "score": 0.822025,
    "coordinate_unit": "pixel",
    "bbox_format": "xyxy",
    "bbox_xyxy": [
      318.02,
      308.44,
      390.28,
      369.8
    ],
    "bbox_width": 72.25,
    "bbox_height": 61.37
  },
  {
    "sample_id": "traffic",
    "coco_image_id": 210273,
    "image_width": 640,
    "image_height": 428,
    "task": "object_detection",
    "taxonomy_name": "COCO-80",
    "model_file": "yolo11n.pt",
    "model_sha256": "0ebbc80d4a7680d14987a577cd21342b65ecfd94632bd9a8da63ae6417644ee1",
    "ultralytics_version": "8.4.145",
    "score_threshold": 0.6,
    "class_id": 2,
    "class_name": "car",
    "score": 0.771383,
    "coordinate_unit": "pixel",
    "bbox_format": "xyxy",
    "bbox_xyxy": [
      300.78,
      252.08,
      370.32,
      320.41
    ],
    "bbox_width": 69.55,
    "bbox_height": 68.33
  },
  {
    "sample_id": "traffic",
    "coco_image_id": 210273,
    "image_width": 640,
    "image_height": 428,
    "task": "object_detection",
    "taxonomy_name": "COCO-80",
    "model_file": "yolo11n.pt",
    "model_sha256": "0ebbc80d4a7680d14987a577cd21342b65ecfd94632bd9a8da63ae6417644ee1",
    "ultralytics_version": "8.4.145",
    "score_threshold": 0.6,
    "class_id": 0,
    "class_name": "person",
    "score": 0.769676,
    "coordinate_unit": "pixel",
    "bbox_format": "xyxy",
    "bbox_xyxy": [
      0.08,
      256.79,
      18.39,
      313.12
    ],
    "bbox_width": 18.32,
    "bbox_height": 56.33
  },
  {
    "sample_id": "traffic",
    "coco_image_id": 210273,
    "image_width": 640,
    "image_height": 428,
    "task": "object_detection",
    "taxonomy_name": "COCO-80",
    "model_file": "yolo11n.pt",
    "model_sha256": "0ebbc80d4a7680d14987a577cd21342b65ecfd94632bd9a8da63ae6417644ee1",
    "ultralytics_version": "8.4.145",
    "score_threshold": 0.6,
    "class_id": 2,
    "class_name": "car",
    "score": 0.759714,
    "coordinate_unit": "pixel",
    "bbox_format": "xyxy",
    "bbox_xyxy": [
      268.46,
      217.4,
      326.52,
      268.12
    ],
    "bbox_width": 58.06,
    "bbox_height": 50.72
  },
  {
    "sample_id": "traffic",
    "coco_image_id": 210273,
    "image_width": 640,
    "image_height": 428,
    "task": "object_detection",
    "taxonomy_name": "COCO-80",
    "model_file": "yolo11n.pt",
    "model_sha256": "0ebbc80d4a7680d14987a577cd21342b65ecfd94632bd9a8da63ae6417644ee1",
    "ultralytics_version": "8.4.145",
    "score_threshold": 0.6,
    "class_id": 2,
    "class_name": "car",
    "score": 0.749282,
    "coordinate_unit": "pixel",
    "bbox_format": "xyxy",
    "bbox_xyxy": [
      505.49,
      136.85,
      540.71,
      165.27
    ],
    "bbox_width": 35.22,
    "bbox_height": 28.42
  },
  {
    "sample_id": "traffic",
    "coco_image_id": 210273,
    "image_width": 640,
    "image_height": 428,
    "task": "object_detection",
    "taxonomy_name": "COCO-80",
    "model_file": "yolo11n.pt",
    "model_sha256": "0ebbc80d4a7680d14987a577cd21342b65ecfd94632bd9a8da63ae6417644ee1",
    "ultralytics_version": "8.4.145",
    "score_threshold": 0.6,
    "class_id": 2,
    "class_name": "car",
    "score": 0.634069,
    "coordinate_unit": "pixel",
    "bbox_format": "xyxy",
    "bbox_xyxy": [
      407.77,
      200.35,
      482.27,
      289.08
    ],
    "bbox_width": 74.5,
    "bbox_height": 88.73
  },
  {
    "sample_id": "traffic",
    "coco_image_id": 210273,
    "image_width": 640,
    "image_height": 428,
    "task": "object_detection",
    "taxonomy_name": "COCO-80",
    "model_file": "yolo11n.pt",
    "model_sha256": "0ebbc80d4a7680d14987a577cd21342b65ecfd94632bd9a8da63ae6417644ee1",
    "ultralytics_version": "8.4.145",
    "score_threshold": 0.6,
    "class_id": 2,
    "class_name": "car",
    "score": 0.609901,
    "coordinate_unit": "pixel",
    "bbox_format": "xyxy",
    "bbox_xyxy": [
      329.2,
      200.27,
      377.52,
      246.94
    ],
    "bbox_width": 48.32,
    "bbox_height": 46.66
  },
  {
    "sample_id": "traffic",
    "coco_image_id": 210273,
    "image_width": 640,
    "image_height": 428,
    "task": "object_detection",
    "taxonomy_name": "COCO-80",
    "model_file": "yolo11n.pt",
    "model_sha256": "0ebbc80d4a7680d14987a577cd21342b65ecfd94632bd9a8da63ae6417644ee1",
    "ultralytics_version": "8.4.145",
    "score_threshold": 0.6,
    "class_id": 2,
    "class_name": "car",
    "score": 0.605583,
    "coordinate_unit": "pixel",
    "bbox_format": "xyxy",
    "bbox_xyxy": [
      582.27,
      123.38,
      623.06,
      158.96
    ],
    "bbox_width": 40.79,
    "bbox_height": 35.58
  },
  {
    "sample_id": "kitchen",
    "coco_image_id": 397133,
    "image_width": 640,
    "image_height": 427,
    "task": "object_detection",
    "taxonomy_name": "COCO-80",
    "model_file": "yolo11n.pt",
    "model_sha256": "0ebbc80d4a7680d14987a577cd21342b65ecfd94632bd9a8da63ae6417644ee1",
    "ultralytics_version": "8.4.145",
    "score_threshold": 0.6,
    "class_id": 0,
    "class_name": "person",
    "score": 0.912625,
    "coordinate_unit": "pixel",
    "bbox_format": "xyxy",
    "bbox_xyxy": [
      385.33,
      69.24,
      498.92,
      348.92
    ],
    "bbox_width": 113.58,
    "bbox_height": 279.68
  },
  {
    "sample_id": "kitchen",
    "coco_image_id": 397133,
    "image_width": 640,
    "image_height": 427,
    "task": "object_detection",
    "taxonomy_name": "COCO-80",
    "model_file": "yolo11n.pt",
    "model_sha256": "0ebbc80d4a7680d14987a577cd21342b65ecfd94632bd9a8da63ae6417644ee1",
    "ultralytics_version": "8.4.145",
    "score_threshold": 0.6,
    "class_id": 45,
    "class_name": "bowl",
    "score": 0.719063,
    "coordinate_unit": "pixel",
    "bbox_format": "xyxy",
    "bbox_xyxy": [
      32.65,
      342.12,
      100.16,
      384.93
    ],
    "bbox_width": 67.51,
    "bbox_height": 42.81
  },
  {
    "sample_id": "kitchen",
    "coco_image_id": 397133,
    "image_width": 640,
    "image_height": 427,
    "task": "object_detection",
    "taxonomy_name": "COCO-80",
    "model_file": "yolo11n.pt",
    "model_sha256": "0ebbc80d4a7680d14987a577cd21342b65ecfd94632bd9a8da63ae6417644ee1",
    "ultralytics_version": "8.4.145",
    "score_threshold": 0.6,
    "class_id": 45,
    "class_name": "bowl",
    "score": 0.701282,
    "coordinate_unit": "pixel",
    "bbox_format": "xyxy",
    "bbox_xyxy": [
      155.02,
      168.67,
      182.38,
      184.18
    ],
    "bbox_width": 27.36,
    "bbox_height": 15.51
  },
  {
    "sample_id": "kitchen",
    "coco_image_id": 397133,
    "image_width": 640,
    "image_height": 427,
    "task": "object_detection",
    "taxonomy_name": "COCO-80",
    "model_file": "yolo11n.pt",
    "model_sha256": "0ebbc80d4a7680d14987a577cd21342b65ecfd94632bd9a8da63ae6417644ee1",
    "ultralytics_version": "8.4.145",
    "score_threshold": 0.6,
    "class_id": 69,
    "class_name": "oven",
    "score": 0.686791,
    "coordinate_unit": "pixel",
    "bbox_format": "xyxy",
    "bbox_xyxy": [
      0.11,
      187.54,
      195.96,
      292.81
    ],
    "bbox_width": 195.85,
    "bbox_height": 105.26
  },
  {
    "sample_id": "kitchen",
    "coco_image_id": 397133,
    "image_width": 640,
    "image_height": 427,
    "task": "object_detection",
    "taxonomy_name": "COCO-80",
    "model_file": "yolo11n.pt",
    "model_sha256": "0ebbc80d4a7680d14987a577cd21342b65ecfd94632bd9a8da63ae6417644ee1",
    "ultralytics_version": "8.4.145",
    "score_threshold": 0.6,
    "class_id": 69,
    "class_name": "oven",
    "score": 0.6343,
    "coordinate_unit": "pixel",
    "bbox_format": "xyxy",
    "bbox_xyxy": [
      489.09,
      200.73,
      617.81,
      344.88
    ],
    "bbox_width": 128.72,
    "bbox_height": 144.15
  },
  {
    "sample_id": "kitchen",
    "coco_image_id": 397133,
    "image_width": 640,
    "image_height": 427,
    "task": "object_detection",
    "taxonomy_name": "COCO-80",
    "model_file": "yolo11n.pt",
    "model_sha256": "0ebbc80d4a7680d14987a577cd21342b65ecfd94632bd9a8da63ae6417644ee1",
    "ultralytics_version": "8.4.145",
    "score_threshold": 0.6,
    "class_id": 0,
    "class_name": "person",
    "score": 0.61093,
    "coordinate_unit": "pixel",
    "bbox_format": "xyxy",
    "bbox_xyxy": [
      0.12,
      263.18,
      61.55,
      310.78
    ],
    "bbox_width": 61.44,
    "bbox_height": 47.59
  },
  {
    "sample_id": "dining",
    "coco_image_id": 166918,
    "image_width": 480,
    "image_height": 640,
    "task": "object_detection",
    "taxonomy_name": "COCO-80",
    "model_file": "yolo11n.pt",
    "model_sha256": "0ebbc80d4a7680d14987a577cd21342b65ecfd94632bd9a8da63ae6417644ee1",
    "ultralytics_version": "8.4.145",
    "score_threshold": 0.6,
    "class_id": 60,
    "class_name": "dining table",
    "score": 0.894425,
    "coordinate_unit": "pixel",
    "bbox_format": "xyxy",
    "bbox_xyxy": [
      0.0,
      318.65,
      478.73,
      638.83
    ],
    "bbox_width": 478.73,
    "bbox_height": 320.18
  },
  {
    "sample_id": "dining",
    "coco_image_id": 166918,
    "image_width": 480,
    "image_height": 640,
    "task": "object_detection",
    "taxonomy_name": "COCO-80",
    "model_file": "yolo11n.pt",
    "model_sha256": "0ebbc80d4a7680d14987a577cd21342b65ecfd94632bd9a8da63ae6417644ee1",
    "ultralytics_version": "8.4.145",
    "score_threshold": 0.6,
    "class_id": 0,
    "class_name": "person",
    "score": 0.752877,
    "coordinate_unit": "pixel",
    "bbox_format": "xyxy",
    "bbox_xyxy": [
      209.32,
      265.03,
      250.98,
      329.14
    ],
    "bbox_width": 41.67,
    "bbox_height": 64.11
  },
  {
    "sample_id": "dining",
    "coco_image_id": 166918,
    "image_width": 480,
    "image_height": 640,
    "task": "object_detection",
    "taxonomy_name": "COCO-80",
    "model_file": "yolo11n.pt",
    "model_sha256": "0ebbc80d4a7680d14987a577cd21342b65ecfd94632bd9a8da63ae6417644ee1",
    "ultralytics_version": "8.4.145",
    "score_threshold": 0.6,
    "class_id": 41,
    "class_name": "cup",
    "score": 0.729154,
    "coordinate_unit": "pixel",
    "bbox_format": "xyxy",
    "bbox_xyxy": [
      353.95,
      479.64,
      394.37,
      568.39
    ],
    "bbox_width": 40.42,
    "bbox_height": 88.75
  },
  {
    "sample_id": "dining",
    "coco_image_id": 166918,
    "image_width": 480,
    "image_height": 640,
    "task": "object_detection",
    "taxonomy_name": "COCO-80",
    "model_file": "yolo11n.pt",
    "model_sha256": "0ebbc80d4a7680d14987a577cd21342b65ecfd94632bd9a8da63ae6417644ee1",
    "ultralytics_version": "8.4.145",
    "score_threshold": 0.6,
    "class_id": 0,
    "class_name": "person",
    "score": 0.673663,
    "coordinate_unit": "pixel",
    "bbox_format": "xyxy",
    "bbox_xyxy": [
      86.87,
      281.36,
      161.13,
      384.82
    ],
    "bbox_width": 74.26,
    "bbox_height": 103.46
  },
  {
    "sample_id": "dining",
    "coco_image_id": 166918,
    "image_width": 480,
    "image_height": 640,
    "task": "object_detection",
    "taxonomy_name": "COCO-80",
    "model_file": "yolo11n.pt",
    "model_sha256": "0ebbc80d4a7680d14987a577cd21342b65ecfd94632bd9a8da63ae6417644ee1",
    "ultralytics_version": "8.4.145",
    "score_threshold": 0.6,
    "class_id": 0,
    "class_name": "person",
    "score": 0.642036,
    "coordinate_unit": "pixel",
    "bbox_format": "xyxy",
    "bbox_xyxy": [
      397.32,
      283.98,
      479.93,
      457.32
    ],
    "bbox_width": 82.61,
    "bbox_height": 173.34
  },
  {
    "sample_id": "dining",
    "coco_image_id": 166918,
    "image_width": 480,
    "image_height": 640,
    "task": "object_detection",
    "taxonomy_name": "COCO-80",
    "model_file": "yolo11n.pt",
    "model_sha256": "0ebbc80d4a7680d14987a577cd21342b65ecfd94632bd9a8da63ae6417644ee1",
    "ultralytics_version": "8.4.145",
    "score_threshold": 0.6,
    "class_id": 0,
    "class_name": "person",
    "score": 0.6397,
    "coordinate_unit": "pixel",
    "bbox_format": "xyxy",
    "bbox_xyxy": [
      0.03,
      298.0,
      54.44,
      444.42
    ],
    "bbox_width": 54.41,
    "bbox_height": 146.42
  },
  {
    "sample_id": "dining",
    "coco_image_id": 166918,
    "image_width": 480,
    "image_height": 640,
    "task": "object_detection",
    "taxonomy_name": "COCO-80",
    "model_file": "yolo11n.pt",
    "model_sha256": "0ebbc80d4a7680d14987a577cd21342b65ecfd94632bd9a8da63ae6417644ee1",
    "ultralytics_version": "8.4.145",
    "score_threshold": 0.6,
    "class_id": 40,
    "class_name": "wine glass",
    "score": 0.613271,
    "coordinate_unit": "pixel",
    "bbox_format": "xyxy",
    "bbox_xyxy": [
      388.41,
      436.68,
      418.73,
      535.38
    ],
    "bbox_width": 30.33,
    "bbox_height": 98.7
  }
]

reports/REPORT.md

## 2. Phát hiện vật thể

1.   
  {
    "sample_id": "traffic",
    "coco_image_id": 210273,
    "image_width": 640,
    "image_height": 428,
    "task": "object_detection",
    "taxonomy_name": "COCO-80",
    "model_file": "yolo11n.pt",
    "model_sha256": "0ebbc80d4a7680d14987a577cd21342b65ecfd94632bd9a8da63ae6417644ee1",
    "ultralytics_version": "8.4.145",
    "score_threshold": 0.35,
    "class_id": 5,
    "class_name": "bus",
    "score": 0.912558,
    "coordinate_unit": "pixel",
    "bbox_format": "xyxy",
    "bbox_xyxy": [
      93.17,
      187.95,
      223.01,
      320.91
    ],
    "bbox_width": 129.84,
    "bbox_height": 132.96
  },

2. Giải thích box bằng lời thường: góc trên-trái ở đâu, góc dưới-phải ở đâu, rộng/cao bao nhiêu pixel?
Qua thông tin ở trên, góc trên-trái là (93.17, 187.95), góc dưới phải là (223.01, 320.91). Cùng với đó chiều rộng của box là 129.84 pixel và chiều cao là 132.96 pixel